Title,Created At,Updated At,Additions,Commits,Status,Comments,Merged At,Author
lib: make fetch sync and return a Promise,2023-09-28 18:05:11+00:00,2023-09-30 18:51:27+00:00,10,1,Merged,4,2023-09-30 18:48:36+00:00,KhafraDev
[v20.x backport] test_runner: catch reporter errors,2023-09-28 21:27:49+00:00,2024-05-24 09:01:33+00:00,49,1,Closed,5,0,MoLow
[v20.x backport] snapshot test improvments,2023-09-28 21:34:55+00:00,2023-11-12 10:36:03+00:00,141,2,Closed,3,0,MoLow
test_runner: replace spurious if with else,2023-09-28 23:36:50+00:00,2023-09-29 13:25:55+00:00,1,1,Merged,4,2023-09-29 11:04:58+00:00,cjihrig
esm: allow `--import` to define main entry,2023-09-29 04:40:40+00:00,2024-05-12 10:34:56+00:00,64,1,Open,14,0,GeoffreyBooth
vm: use default host-defined options when importModuleDynamically is not set,2023-09-29 12:57:52+00:00,2023-11-12 10:50:36+00:00,81,2,Merged,34,2023-10-05 00:11:05+00:00,joyeecheung
doc: update CHANGELOG_V20 about vm fixes,2023-09-29 13:20:07+00:00,2024-05-13 05:24:14+00:00,1,1,Merged,2,2023-09-29 16:20:46+00:00,joyeecheung
wasi: fix up wasi tests for ibmi,2023-09-29 14:24:53+00:00,2023-10-04 16:35:41+00:00,21,2,Merged,14,2023-10-04 16:35:39+00:00,mhdawson
"errors: fix stacktrace of SystemError, add more tests and benchmark",2023-09-29 15:08:46+00:00,2023-12-23 17:05:06+00:00,344,1,Closed,15,0,Uzlopak
stream: optimize writable fast path,2023-09-29 15:45:24+00:00,2024-06-06 08:12:55+00:00,84,3,Closed,3,0,ronag
test: update skip for moved `test-wasm-web-api`,2023-09-29 15:56:37+00:00,2023-09-30 23:30:28+00:00,4,1,Merged,5,2023-09-30 18:10:14+00:00,richardlau
esm: improve JSDoc annotation of internal functions,2023-09-29 16:27:34+00:00,2023-11-23 09:51:17+00:00,16,2,Merged,4,2023-10-01 07:26:56+00:00,aduh95
doc: update link to Abstract Modules Records spec,2023-09-29 16:53:38+00:00,2023-10-01 19:57:57+00:00,1,1,Merged,2,2023-10-01 18:41:52+00:00,Trott
`node:fs` error path performance improvements,2023-09-29 17:20:04+00:00,2023-10-18 15:56:30+00:00,355,8,Closed,37,0,anonrig
stream: readable bimap,2023-09-29 17:42:32+00:00,2023-10-17 19:10:09+00:00,191,1,Merged,37,2023-10-17 19:09:34+00:00,ronag
tools: exempt FastApiCallbackOptions from runtime/references lint check,2023-09-29 18:21:14+00:00,2023-10-15 19:05:14+00:00,1258,26,Closed,4,0,TonyRippy
esm: improve `getFormatOfExtensionlessFile` perf.,2023-09-29 18:25:45+00:00,2023-10-01 18:32:09+00:00,76,1,Merged,14,2023-10-01 18:32:07+00:00,anonrig
stream: avoid tick in writable hot path,2023-09-29 19:56:12+00:00,2023-10-01 20:07:14+00:00,19,1,Merged,9,2023-10-01 20:07:12+00:00,ronag
lib: add global require when running esm,2023-09-30 00:28:38+00:00,2023-09-30 04:02:29+00:00,16,1,Closed,8,0,KhafraDev
fs: move getValidMode to c++ for better performance,2023-09-30 00:58:25+00:00,2023-12-16 03:40:40+00:00,114,2,Closed,27,0,andremralves
tls: use `validateNumber` for `options.minDHSize`,2023-09-30 03:18:26+00:00,2023-10-06 13:18:36+00:00,17,1,Merged,7,2023-10-06 13:18:34+00:00,deokjinkim
esm: unflag extensionless ES module JavaScript and Wasm in module scope,2023-09-30 05:30:14+00:00,2023-11-23 09:51:43+00:00,174,5,Closed,11,0,GeoffreyBooth
"module,src: add `--experimental-entry-url` flag",2023-09-30 07:22:45+00:00,2024-05-12 10:34:56+00:00,154,2,Open,2,0,aduh95
nghttp3_conv: fix call to undeclared functions 'ntohl' and 'htons',2023-09-30 12:27:16+00:00,2023-10-02 12:44:19+00:00,2,1,Merged,12,2023-10-02 12:44:17+00:00,MatteoBax
tls: handle cases where the raw socket is destroyed,2023-09-30 15:18:29+00:00,2023-10-04 14:24:37+00:00,38,1,Merged,6,2023-10-04 14:19:42+00:00,lpinca
deps: update googletest to e47544a,2023-10-01 00:26:01+00:00,2023-10-03 13:08:22+00:00,56,1,Merged,6,2023-10-03 13:08:20+00:00,nodejs-github-bot
tools: update lint-md-dependencies to remark-parse@11.0.0 remark-preset-lint-node@5.0.0 remark-stringify@11.0.0 rollup@3.29.4,2023-10-01 00:26:33+00:00,2023-10-03 13:08:33+00:00,13905,1,Merged,1,2023-10-03 13:08:31+00:00,nodejs-github-bot
deps: update ada to 2.6.10,2023-10-01 00:45:07+00:00,2023-10-03 00:48:10+00:00,33,1,Merged,5,2023-10-03 00:48:08+00:00,nodejs-github-bot
esm: bypass CommonJS loader under `--default-type=module`,2023-10-01 04:13:47+00:00,2023-11-23 09:52:10+00:00,176,11,Merged,7,2023-10-05 17:57:32+00:00,GeoffreyBooth
deps: update zlib to 1.2.13.1-motley-fef5869,2023-10-01 05:22:43+00:00,2023-10-08 05:15:37+00:00,126,2,Closed,4,0,nodejs-github-bot
tools: update doc to highlight.js@11.9.0 remark-frontmatter@5.0.0 remark-gfm@4.0.0 remark-html@16.0.1 remark-parse@11.0.0 remark-rehype@11.0.0 unified@11.0.3,2023-10-01 05:24:13+00:00,2023-12-21 01:02:20+00:00,568,3,Merged,4,2023-10-26 12:42:35+00:00,nodejs-github-bot
tools: update eslint to 8.50.0,2023-10-01 05:44:59+00:00,2023-10-03 15:32:44+00:00,2878,2,Merged,4,2023-10-03 15:32:41+00:00,nodejs-github-bot
errors: improve hideStackFrames,2023-10-01 09:36:26+00:00,2023-11-13 07:42:29+00:00,978,1,Merged,27,2023-11-11 16:25:08+00:00,Uzlopak
tools: pass explicit section list to objdump,2023-10-01 11:41:57+00:00,2023-11-01 14:41:26+00:00,40,1,Closed,10,0,citrus-it
streams: use private symbol for bitmap state,2023-10-01 11:50:48+00:00,2023-10-14 21:51:39+00:00,152,1,Merged,12,2023-10-14 21:50:30+00:00,ronag
"test_runner, cli: add --test-concurrency flag",2023-10-01 15:49:05+00:00,2023-10-10 09:06:13+00:00,70,1,Merged,6,2023-10-08 20:11:42+00:00,cjihrig
test: deflake test-runner-watch-mode,2023-10-01 17:07:43+00:00,2024-05-24 09:01:35+00:00,3,1,Closed,12,0,MoLow
test_runner: add test location for FileTests,2023-10-01 17:41:25+00:00,2023-10-03 18:19:59+00:00,32,1,Merged,6,2023-10-03 18:19:51+00:00,cjihrig
meta: bump actions/upload-artifact from 3.1.2 to 3.1.3,2023-10-01 18:17:16+00:00,2023-10-04 19:15:13+00:00,4,1,Merged,2,2023-10-04 19:15:11+00:00,dependabot[bot]
meta: bump actions/checkout from 3.6.0 to 4.1.0,2023-10-01 18:17:27+00:00,2023-10-04 19:04:55+00:00,39,1,Merged,2,2023-10-04 19:04:53+00:00,dependabot[bot]
meta: bump github/codeql-action from 2.21.5 to 2.21.9,2023-10-01 18:17:31+00:00,2023-10-04 19:05:05+00:00,1,1,Merged,2,2023-10-04 19:05:03+00:00,dependabot[bot]
meta: bump actions/cache from 3.3.1 to 3.3.2,2023-10-01 18:17:35+00:00,2023-10-04 19:05:15+00:00,1,1,Merged,2,2023-10-04 19:05:13+00:00,dependabot[bot]
esm: bypass CJS loader in default load under `--default-type=module`,2023-10-01 19:14:37+00:00,2023-11-10 08:21:14+00:00,105,4,Merged,4,2023-11-10 08:20:46+00:00,aduh95
doc: update Collaborator pronouns,2023-10-01 19:40:34+00:00,2023-10-01 20:07:22+00:00,1,1,Merged,2,2023-10-01 20:07:21+00:00,bnb
lchown sync improvement,2023-10-01 22:31:50+00:00,2023-10-03 21:24:33+00:00,29,1,Closed,3,0,IlyasShabi
perf_hooks: reducing overhead of performance observer entry list,2023-10-02 00:33:08+00:00,2023-10-04 00:42:54+00:00,64,3,Merged,3,2023-10-04 00:38:32+00:00,H4ad
fs: add flush option to writeFile() functions,2023-10-02 03:57:40+00:00,2024-05-02 07:37:17+00:00,210,2,Merged,5,2023-10-04 13:10:31+00:00,cjihrig
src: name scoped lock,2023-10-02 07:14:41+00:00,2023-10-04 14:42:08+00:00,1,1,Merged,2,2023-10-04 07:17:45+00:00,VoltrexKeyva
tools: refactor checkimports.py,2023-10-02 09:39:44+00:00,2023-10-15 15:16:38+00:00,7,1,Merged,11,2023-10-15 15:14:58+00:00,VoltrexKeyva
perf: optimize Writable,2023-10-02 10:06:21+00:00,2023-10-16 12:55:04+00:00,22,1,Merged,12,2023-10-04 10:13:07+00:00,ronag
stream: lazy allocate back pressure buffer,2023-10-02 11:57:50+00:00,2023-10-05 20:27:47+00:00,41,1,Merged,11,2023-10-05 20:27:45+00:00,ronag
stream: avoid unnecessary drain for sync stream,2023-10-02 12:26:49+00:00,2023-10-04 12:45:42+00:00,12,1,Merged,13,2023-10-04 12:45:40+00:00,ronag
test_runner: adds built in lcov test reporter,2023-10-02 23:46:17+00:00,2023-12-12 13:20:44+00:00,868,14,Merged,28,2023-10-25 12:11:32+00:00,philnash
doc: reserve 119 for Electron 28,2023-10-03 06:50:26+00:00,2023-11-27 10:31:09+00:00,1,1,Merged,3,2023-10-03 12:12:59+00:00,dsanders11
stream: avoid buffering in sync path,2023-10-03 08:00:44+00:00,2023-10-21 14:32:56+00:00,1,1,Closed,2,0,ronag
tools: remove genv8constants.py,2023-10-03 10:49:53+00:00,2023-10-05 21:11:12+00:00,1,1,Merged,2,2023-10-05 21:11:10+00:00,bnoordhuis
deps: update undici to 5.25.4,2023-10-03 15:36:48+00:00,2023-11-26 18:53:01+00:00,3375,1,Merged,15,2023-10-08 06:39:07+00:00,nodejs-github-bot
src: avoid making JSTransferable wrapper object weak,2023-10-03 15:45:32+00:00,2023-11-11 19:00:37+00:00,37,1,Merged,10,2023-10-10 07:42:30+00:00,legendecas
deps: upgrade npm to 10.2.0,2023-10-03 16:14:20+00:00,2023-10-13 13:55:40+00:00,13184,1,Merged,10,2023-10-13 13:55:38+00:00,npm-cli-bot
doc: use precise terminology in test runner,2023-10-03 17:35:17+00:00,2023-10-08 10:05:18+00:00,6,2,Merged,3,2023-10-08 10:05:05+00:00,benjamingr
doc: use precise promise terminology in fs,2023-10-03 17:44:41+00:00,2023-10-08 10:07:11+00:00,14,1,Merged,1,2023-10-08 10:06:58+00:00,benjamingr
[v18.x] deps: upgrade npm to 10.2.0,2023-10-03 19:18:39+00:00,2023-10-28 09:36:42+00:00,36465,1,Closed,3,0,npm-cli-bot
fs: improve error performance for `ftruncateSync`,2023-10-03 22:16:05+00:00,2023-10-10 22:24:26+00:00,46,1,Merged,5,2023-10-10 22:24:24+00:00,andremralves
fs: improve error performance for `readSync`,2023-10-04 02:28:03+00:00,2023-11-08 02:24:31+00:00,71,5,Merged,13,2023-10-21 02:00:01+00:00,pluris
crypto: account for disabled `SharedArrayBuffer`,2023-10-04 09:14:11+00:00,2023-10-06 09:17:07+00:00,4,1,Merged,5,2023-10-06 09:17:05+00:00,codebytere
benchmark: fix race condition on fs benchs,2023-10-04 11:47:55+00:00,2023-10-15 10:55:29+00:00,99,5,Merged,21,2023-10-15 10:55:28+00:00,H4ad
[v18.x] Temporarily revert libuv,2023-10-04 12:17:15+00:00,2023-10-06 16:03:18+00:00,5411,4,Closed,10,0,richardlau
os: improve performance of hostname and homedir,2023-10-04 12:21:16+00:00,2024-05-12 09:44:09+00:00,95,1,Merged,27,2023-10-15 06:50:31+00:00,Uzlopak
fs: improve error performance of writevSync,2023-10-04 13:37:50+00:00,2023-10-12 01:58:43+00:00,76,1,Merged,7,2023-10-12 01:58:41+00:00,IlyasShabi
"test,crypto: update WebCryptoAPI WPT",2023-10-04 14:51:34+00:00,2023-10-06 14:59:45+00:00,36,1,Merged,3,2023-10-06 14:59:36+00:00,panva
"module: initialize hook returns load, resolve",2023-10-04 19:41:34+00:00,2024-05-12 10:34:56+00:00,26,1,Open,7,0,ggoodman
lib: let deps require `node` prefixed modules,2023-10-04 21:00:41+00:00,2023-10-06 23:12:37+00:00,3,1,Merged,8,2023-10-06 21:04:05+00:00,KhafraDev
tools: add --rerun-failures option,2023-10-05 09:10:22+00:00,2023-10-18 11:33:00+00:00,106,4,Closed,2,0,StefanStojanovic
test: improve code coverage of diagnostics_channel,2023-10-05 13:52:03+00:00,2023-10-19 06:38:30+00:00,39,1,Merged,12,2023-10-19 06:37:09+00:00,MrJithil
crypto: use X509_ALGOR accessors instead of reaching into X509_ALGOR,2023-10-05 21:17:40+00:00,2023-10-09 13:41:04+00:00,9,1,Merged,4,2023-10-09 13:41:02+00:00,davidben
node-api: segregate nogc APIs from rest via type system,2023-10-06 06:43:48+00:00,2024-05-10 23:24:52+00:00,368,1,Merged,15,2023-12-19 07:37:16+00:00,gabrielschulhof
src: create per isolate properties for the module loader,2023-10-06 12:51:34+00:00,2023-10-17 09:26:45+00:00,91,4,Closed,1,0,legendecas
v18.18.1 proposal,2023-10-06 16:56:04+00:00,2023-10-06 17:29:32+00:00,5554,7,Closed,6,0,richardlau
v18.18.1 proposal,2023-10-06 17:27:08+00:00,2023-10-10 15:48:16+00:00,5554,7,Merged,2,2023-10-10 15:48:14+00:00,richardlau
doc: add command to get patch minors and majors,2023-10-06 21:32:42+00:00,2023-10-08 21:36:49+00:00,6,1,Merged,2,2023-10-08 21:36:47+00:00,RafaelGSS
doc: move permission model to Active Development,2023-10-06 21:41:02+00:00,2023-10-08 21:45:12+00:00,6,1,Merged,2,2023-10-08 21:45:10+00:00,RafaelGSS
"cluster.worker.on('message', (msg) => ...) fails to register a callback if ESM file extensions is used",2023-10-06 21:41:47+00:00,2023-10-07 12:35:41+00:00,698,1,Closed,1,0,aleksejaku
"cluster.worker.on('message', (msg) => ...) fails to register a callback if ESM file extensions is used",2023-10-06 22:24:32+00:00,2023-10-07 11:41:40+00:00,98037,553,Closed,4,0,aleksejaku
doc: mention files read before env setup,2023-10-06 22:50:41+00:00,2023-10-08 22:56:02+00:00,4,1,Merged,2,2023-10-08 22:56:01+00:00,RafaelGSS
benchmark: add warmup to accessSync bench,2023-10-07 00:29:57+00:00,2023-10-14 19:51:32+00:00,13,1,Merged,3,2023-10-14 19:51:30+00:00,RafaelGSS
perf_hooks: reduce overhead of createHistogram,2023-10-07 00:57:24+00:00,2023-12-28 22:08:52+00:00,89,5,Closed,15,0,H4ad
[v20.x] deps: cherry-pick V8 fixes for CVE-2023-3420 and others,2023-10-07 06:43:05+00:00,2024-03-20 15:50:14+00:00,21,5,Closed,38,0,targos
deps: update llhttp to 9.1.3,2023-10-08 00:24:16+00:00,2024-01-09 13:29:12+00:00,362,1,Closed,5,0,nodejs-github-bot
deps: update googletest to 2dd1c13,2023-10-08 00:24:18+00:00,2023-10-10 00:45:47+00:00,16,1,Merged,4,2023-10-10 00:45:45+00:00,nodejs-github-bot
deps: update c-ares to 1.20.1,2023-10-08 00:24:21+00:00,2023-10-20 23:44:48+00:00,7812,2,Closed,14,0,nodejs-github-bot
tools: update lint-md-dependencies to @rollup/plugin-commonjs@25.0.5 @rollup/plugin-node-resolve@15.2.2 rollup@4.0.2,2023-10-08 00:24:54+00:00,2023-10-10 00:45:56+00:00,193,1,Merged,1,2023-10-10 00:45:54+00:00,nodejs-github-bot
tools: update eslint to 8.51.0,2023-10-08 00:26:03+00:00,2023-10-08 18:51:07+00:00,2426,1,Merged,2,2023-10-08 18:51:04+00:00,nodejs-github-bot
deps: update zlib to 1.2.13.1-motley-fef5869,2023-10-08 05:16:40+00:00,2023-10-10 05:23:10+00:00,126,1,Merged,5,2023-10-10 05:23:08+00:00,nodejs-github-bot
doc: add loong64 info into platform list,2023-10-08 06:45:19+00:00,2023-11-27 10:44:37+00:00,1,1,Merged,3,2023-10-22 10:07:13+00:00,shipujin
deps: update corepack to 0.21.0,2023-10-08 07:55:21+00:00,2023-10-27 14:55:48+00:00,641,1,Merged,5,2023-10-11 16:03:58+00:00,nodejs-github-bot
"fs,url: refactor `FileURLToPath` and `FromNamespacedPath`",2023-10-08 17:25:42+00:00,2023-10-26 02:26:43+00:00,161,3,Closed,18,0,anonrig
deps: update simdutf to 3.2.18,2023-10-08 19:25:56+00:00,2023-10-10 19:34:35+00:00,12,1,Merged,3,2023-10-10 19:34:32+00:00,nodejs-github-bot
fs: add flush option to createWriteStream(),2023-10-08 22:01:09+00:00,2023-10-11 19:38:51+00:00,118,4,Merged,11,2023-10-11 16:25:05+00:00,cjihrig
fs: add flush option to appendFile() functions,2023-10-08 23:27:56+00:00,2023-10-23 09:21:01+00:00,135,1,Merged,15,2023-10-18 01:51:41+00:00,cjihrig
esm: detect ESM syntax in ambiguous JavaScript,2023-10-09 05:42:17+00:00,2023-12-21 14:40:03+00:00,475,8,Merged,36,2023-10-20 15:44:57+00:00,GeoffreyBooth
stream: add support for `deflate-raw` format to webstreams compression,2023-10-09 06:47:49+00:00,2023-11-09 11:25:43+00:00,19,1,Merged,8,2023-11-09 11:18:57+00:00,pirxpilot
[v18.x backport] child_process: improve spawn performance on Linux,2023-10-09 11:28:21+00:00,2024-01-12 11:31:56+00:00,38,2,Closed,6,0,aduh95
fs: improve error performance of readvSync,2023-10-09 13:35:15+00:00,2023-12-05 18:31:26+00:00,67,1,Merged,6,2023-12-05 18:31:23+00:00,IlyasShabi
doc: add command to keep major branch sync,2023-10-09 15:05:32+00:00,2023-10-16 23:01:21+00:00,14,1,Merged,3,2023-10-16 23:01:19+00:00,RafaelGSS
test: reduce number of repetition in test-heapdump-shadowrealm.js,2023-10-09 16:30:02+00:00,2023-10-12 09:36:36+00:00,1,1,Merged,3,2023-10-12 09:32:42+00:00,legendecas
[v18.x backport] url test,2023-10-09 20:44:26+00:00,2023-11-27 11:12:19+00:00,16,2,Closed,3,0,aduh95
stream: reduce overhead of transfer,2023-10-09 23:44:02+00:00,2023-11-11 19:02:33+00:00,163,1,Merged,4,2023-10-12 14:37:41+00:00,H4ad
test: fix flaky test-runner-cli-concurrency.js,2023-10-10 01:24:01+00:00,2023-10-12 13:15:15+00:00,30,1,Merged,13,2023-10-12 01:37:00+00:00,cjihrig
lib: fix Module check when monkey patching,2023-10-10 02:11:15+00:00,2023-10-20 21:25:01+00:00,3,1,Closed,13,0,RafaelGSS
lib: reduce overhead of blob clone,2023-10-10 02:30:12+00:00,2023-11-11 19:27:13+00:00,20,3,Merged,9,2023-10-17 06:23:40+00:00,H4ad
doc: add ReflectConstruct to known perf issues,2023-10-10 02:36:07+00:00,2023-10-18 19:32:50+00:00,3,5,Merged,6,2023-10-18 19:28:09+00:00,H4ad
typings: lib/internal/vm.js,2023-10-10 03:48:21+00:00,2024-02-19 01:19:46+00:00,58,3,Merged,12,2024-02-19 01:19:44+00:00,GeoffreyBooth
deps: patch V8 to 11.8.172.15,2023-10-10 06:34:03+00:00,2023-10-17 15:51:12+00:00,39,1,Merged,9,2023-10-17 15:16:23+00:00,targos
deps: update V8 to 11.9,2023-10-10 07:15:05+00:00,2024-01-04 08:48:34+00:00,33944,21,Closed,50,0,targos
tools: remove no-return-await lint rule,2023-10-10 10:37:03+00:00,2023-10-12 11:30:20+00:00,0,1,Merged,1,2023-10-12 10:40:21+00:00,sapphi-red
module: add application/json to accept header when fetching json module,2023-10-10 10:48:59+00:00,2023-10-30 16:51:54+00:00,32,4,Merged,7,2023-10-30 16:51:52+00:00,marco-ippolito
stream: bump default highWaterMark,2023-10-10 12:54:59+00:00,2024-03-14 09:21:43+00:00,25,5,Closed,21,0,RafaelGSS
deps: update nghttp2 to 1.57.0,2023-10-10 14:55:40+00:00,2024-02-22 06:55:16+00:00,335,1,Merged,16,2023-10-11 17:00:54+00:00,jasnell
deps: update nghttp2 to 1.57.0,2023-10-10 15:01:10+00:00,2023-10-10 15:10:33+00:00,333,1,Closed,2,0,nodejs-github-bot
typings: Use `Symbol.dispose` and `Symbol.asyncDispose` in types,2023-10-10 15:50:29+00:00,2023-10-14 12:00:01+00:00,2,1,Merged,3,2023-10-14 06:41:59+00:00,nikeee
test: fix defect path traversal tests,2023-10-10 16:06:40+00:00,2023-10-16 15:50:30+00:00,4,1,Merged,10,2023-10-16 15:50:29+00:00,tniessen
buffer: cleanup,2023-10-10 17:18:14+00:00,2024-05-12 10:34:56+00:00,1,1,Open,3,0,rluvaton
"streams: implement TransformStream cleanup using ""transformer.cancel"" ",2023-10-10 18:02:35+00:00,2024-05-01 12:23:25+00:00,418,7,Merged,29,2023-12-15 07:54:19+00:00,debadree25
esm: improve check for ESM syntax,2023-10-10 18:35:12+00:00,2023-11-11 16:37:26+00:00,207,5,Merged,18,2023-10-18 14:32:35+00:00,GeoffreyBooth
test: add EOVERFLOW as an allowed error,2023-10-10 19:08:20+00:00,2023-11-11 19:04:23+00:00,2,1,Merged,5,2023-10-12 19:13:09+00:00,abmusse
"lib,src: use built-in array buffer detach",2023-10-10 20:56:31+00:00,2024-05-12 10:34:56+00:00,9,2,Open,3,0,anonrig
fs: improve error performance of `readdirSync`,2023-10-10 21:52:58+00:00,2023-10-14 19:35:03+00:00,28,1,Merged,8,2023-10-14 19:35:01+00:00,anonrig
doc: improve ccache explanation,2023-10-11 06:03:06+00:00,2023-10-16 01:38:48+00:00,2,1,Merged,2,2023-10-15 10:55:37+00:00,legendecas
lib: align console.table row to the left,2023-10-11 08:46:21+00:00,2024-01-17 18:36:10+00:00,67,1,Merged,23,2023-10-28 01:14:22+00:00,MrJithil
Reduce TLS 'close' event listener warnings caused by autoSelectFamily,2023-10-11 11:02:34+00:00,2023-11-07 20:28:00+00:00,48,2,Merged,13,2023-10-18 19:44:41+00:00,pimterry
vm: reject in importModuleDynamically without --experimental-vm-modules,2023-10-11 11:56:20+00:00,2023-12-01 17:01:21+00:00,390,3,Closed,27,0,joyeecheung
esm: use import attributes instead of import assertions,2023-10-11 12:29:40+00:00,2023-11-23 09:52:44+00:00,472,13,Merged,5,2023-10-14 03:52:38+00:00,aduh95
vm: use import attributes instead of import assertions,2023-10-11 12:34:28+00:00,2023-11-23 09:53:18+00:00,33,2,Merged,9,2023-10-23 17:30:05+00:00,aduh95
doc: move @danielleadams to tsc non-voting member,2023-10-11 12:51:14+00:00,2023-10-16 00:43:56+00:00,2,1,Merged,4,2023-10-11 16:49:10+00:00,danielleadams
deps: update undici to 5.26.0,2023-10-11 13:42:50+00:00,2023-10-11 20:05:11+00:00,65,1,Closed,19,0,nodejs-github-bot
meta: ping TSC for offboarding,2023-10-11 16:45:22+00:00,2023-10-13 16:55:59+00:00,4,1,Merged,2,2023-10-13 16:55:57+00:00,tniessen
Fixes: update-undici script,2023-10-11 19:19:27+00:00,2023-10-11 19:51:43+00:00,1,1,Closed,2,0,Ethan-Arrowood
[v18.x] deps: update nghttp2 to 1.57.0,2023-10-11 19:24:33+00:00,2023-10-12 18:03:53+00:00,2093,6,Closed,4,0,richardlau
edited by me,2023-10-11 19:45:07+00:00,2023-10-11 19:58:37+00:00,2,1,Closed,0,0,RUPENDER30062003
deps: update undici to v5.26.3,2023-10-11 19:46:31+00:00,2023-10-12 09:42:06+00:00,963,1,Merged,13,2023-10-12 09:42:04+00:00,mcollina
deps: V8: cherry-pick 25902244ad1a,2023-10-11 20:54:17+00:00,2023-10-15 16:30:15+00:00,48,1,Merged,7,2023-10-15 16:30:13+00:00,joyeecheung
src: add commit hash shorthand in zlib version,2023-10-12 03:01:40+00:00,2023-10-23 20:57:25+00:00,18,1,Merged,6,2023-10-23 17:22:16+00:00,MrJithil
tools: fix update-undici.sh path,2023-10-12 16:16:38+00:00,2023-10-12 16:50:27+00:00,2,2,Closed,2,0,Keksonoid
tools: fix update-acorn.sh and undici_version.h path,2023-10-12 16:58:02+00:00,2023-10-12 22:08:25+00:00,2,4,Merged,3,2023-10-12 22:08:06+00:00,Keksonoid
doc: update security release process,2023-10-12 16:58:26+00:00,2023-10-16 19:17:38+00:00,5,1,Closed,2,0,mhdawson
http: reduce parts in chunked response when corking,2023-10-12 20:35:42+00:00,2023-10-16 05:59:02+00:00,87,4,Merged,24,2023-10-15 12:19:48+00:00,ronag
doc: add information about Node-API versions >=9,2023-10-12 21:19:43+00:00,2023-10-25 22:15:11+00:00,26,15,Closed,5,0,mhdawson
"deps,doc,lib,src,test: add experimental web storage",2023-10-12 22:11:47+00:00,2024-04-09 15:45:44+00:00,268189,1,Closed,59,0,cjihrig
doc: add loong64 to list of architectures,2023-10-13 08:36:41+00:00,2023-10-16 20:19:33+00:00,5,1,Merged,1,2023-10-16 20:19:31+00:00,shipujin
stream: improve readable stream read perf,2023-10-13 13:03:13+00:00,2023-10-15 18:43:48+00:00,140,1,Merged,30,2023-10-15 18:31:09+00:00,rluvaton
tools: update comment in `update-uncidi.sh` and `acorn_version.h`,2023-10-13 14:32:33+00:00,2023-11-08 02:24:31+00:00,2,1,Merged,3,2023-10-15 20:28:23+00:00,pluris
test_runner: refactor spec reporter to generator function,2023-10-13 19:14:32+00:00,2023-10-14 22:42:18+00:00,48,3,Closed,6,0,himself65
doc: update release-stewards with last sec-release,2023-10-13 21:58:13+00:00,2023-10-16 23:01:33+00:00,1,1,Merged,2,2023-10-16 23:01:31+00:00,RafaelGSS
esm: rename error code related to import attributes,2023-10-14 06:29:21+00:00,2023-12-14 13:09:46+00:00,71,3,Merged,10,2023-10-18 14:27:55+00:00,aduh95
Update dependabot.yml,2023-10-14 08:29:34+00:00,2023-10-14 08:30:07+00:00,1,1,Closed,0,0,Kibreab-kb-kb
[v20.x backport] esm: use import attributes instead of import assertions,2023-10-14 12:56:07+00:00,2023-11-11 19:23:08+00:00,2048,6,Closed,5,0,aduh95
fs: do not throw error on cpSync internals,2023-10-14 19:12:52+00:00,2023-10-23 17:22:30+00:00,8,1,Merged,5,2023-10-23 17:22:28+00:00,anonrig
tls: fix order of setting cipher before setting cert and key,2023-10-14 21:44:04+00:00,2024-03-19 19:00:45+00:00,68,5,Closed,31,0,kumarrishav
stream: allow pass stream class to `stream.compose`,2023-10-14 22:05:57+00:00,2023-10-23 09:22:30+00:00,15,2,Closed,6,0,himself65
deps: update ada to 2.7.0,2023-10-15 00:24:19+00:00,2023-10-19 01:01:26+00:00,585,1,Closed,4,0,nodejs-github-bot
tools: update lint-md-dependencies to @rollup/plugin-commonjs@25.0.7 @rollup/plugin-node-resolve@15.2.3 rollup@4.1.4,2023-10-15 00:24:47+00:00,2023-10-23 17:11:18+00:00,420,1,Merged,1,2023-10-23 17:11:15+00:00,nodejs-github-bot
tools: exempt FastApiCallbackOptions from runtime/references lint check,2023-10-15 19:02:09+00:00,2023-12-22 21:54:59+00:00,4,1,Closed,0,0,TonyRippy
[v18.x backport] https: fix connection checking interval not clearing on server close,2023-10-16 02:07:09+00:00,2023-12-02 23:57:26+00:00,52,2,Closed,4,0,H4ad
stream: refactor writable _write,2023-10-16 13:34:39+00:00,2023-10-24 13:45:26+00:00,18,1,Merged,12,2023-10-24 13:45:23+00:00,ronag
buffer: remove unnecessary assignment in fromString,2023-10-16 16:51:03+00:00,2023-10-19 11:47:47+00:00,0,1,Merged,2,2023-10-19 11:47:45+00:00,tniessen
lib: add `navigator.userAgent`,2023-10-16 17:32:11+00:00,2023-10-20 23:24:19+00:00,27,1,Merged,18,2023-10-20 20:22:48+00:00,anonrig
util: remove internal mime fns from benchmarks,2023-10-16 17:57:40+00:00,2023-10-21 02:34:57+00:00,0,1,Merged,7,2023-10-21 02:12:44+00:00,Uzlopak
http2: allow streams to complete gracefully after goaway,2023-10-16 18:20:44+00:00,2023-11-14 22:32:20+00:00,23,1,Merged,8,2023-10-20 13:28:18+00:00,murgatroid99
stream: avoid getter for defaultEncoding,2023-10-16 18:49:29+00:00,2023-10-23 12:08:28+00:00,9,1,Merged,11,2023-10-23 12:08:26+00:00,ronag
stream: simplify prefinish,2023-10-16 20:40:08+00:00,2023-10-22 16:43:21+00:00,33,1,Merged,10,2023-10-22 16:43:19+00:00,ronag
docs: update api `stream.compose`,2023-10-16 22:50:21+00:00,2023-10-19 01:05:49+00:00,4,1,Merged,5,2023-10-19 01:00:05+00:00,himself65
test: skip test-benchmark-os.js on IBM i,2023-10-17 01:23:02+00:00,2023-10-18 19:48:33+00:00,4,1,Closed,10,0,abmusse
build: support Python 3.12,2023-10-17 07:25:20+00:00,2024-03-25 10:40:12+00:00,2,1,Merged,15,2023-11-06 14:11:02+00:00,shipujin
[v20.x] deps: V8: cherry-pick 9721082687c9,2023-10-17 07:34:21+00:00,2023-11-21 08:15:29+00:00,3,1,Closed,7,0,shipujin
doc: fix typo in dgram docs,2023-10-17 07:47:13+00:00,2023-10-18 00:46:40+00:00,1,1,Merged,3,2023-10-18 00:46:38+00:00,missinglink
[DO_NOT_MERGE] PR to compare benchmarks between v20.x and v21.0.0,2023-10-17 13:50:14+00:00,2023-10-23 08:16:44+00:00,299897,1,Closed,1,0,targos
permission: address coverity warning,2023-10-17 14:37:18+00:00,2023-10-27 17:18:54+00:00,1,1,Closed,10,0,mhdawson
doc: fix release process table of contents,2023-10-17 18:36:56+00:00,2023-10-20 11:28:59+00:00,2,1,Merged,2,2023-10-20 11:27:27+00:00,richardlau
doc: add H4ad to collaborators,2023-10-17 19:02:20+00:00,2023-12-21 02:18:43+00:00,2,1,Closed,3,0,H4ad
doc: fix H4ad collaborator sort,2023-10-17 19:23:39+00:00,2023-10-17 19:32:23+00:00,2,1,Merged,2,2023-10-17 19:31:49+00:00,H4ad
test: set `test-runner-watch-mode` as flaky,2023-10-17 21:54:48+00:00,2023-10-18 15:01:53+00:00,2,1,Merged,6,2023-10-18 15:01:51+00:00,anonrig
test: set sea snapshot tests as flaky,2023-10-17 22:05:07+00:00,2023-10-18 14:05:42+00:00,3,1,Merged,5,2023-10-18 14:05:40+00:00,anonrig
lib: add navigator.onLine,2023-10-17 22:58:06+00:00,2024-05-12 10:34:56+00:00,66,1,Open,6,0,Uzlopak
